{
  "$schema": "https://json-schema.org/draft/2020-12/schema",
  "$id": "https://meerkats.ai/schemas/ad-dashboards/view-spec/v1.json",
  "title": "On-demand view spec — the living chart contract",
  "description": "The artifact between a query and its pixels, for ON-DEMAND generated charts. Three parts: query (the DSL query_task currently backing the view), envelope (the NAVIGABLE SPACE — facts, dims with drill edges, grains — derived by CODE from the query + catalog, never free-typed), and view (the current presentation, chosen by the representation rules in rules/representation-rules.json — first match wins, deterministic). Every user interaction (drill, pivot, regrain, rerange, compare) is a deterministic transformation of `query` per rules/interactions.json, CONTAINED to the envelope — nothing outside the declared dims/facts/grains is reachable, and no LLM runs at interaction time. Ambiguity gets a fast default, never a question: a wrong first view costs one click because the chart itself is the correction mechanism. Pinning snapshots the CURRENT state into a card-definition (ad-dashboards-prebuilt), so generated charts join the same pin/unpin lifecycle as the prebuilt library.",

  "$ref": "#/$defs/view_spec",

  "$defs": {

    "view_spec": {
      "type": "object",
      "additionalProperties": false,
      "required": ["version", "query", "envelope", "view"],
      "properties": {
        "version": { "const": "1.0" },
        "title": { "type": "string", "description": "short chart title; the user's phrasing, cleaned" },
        "query": {
          "$ref": "https://meerkats.ai/schemas/query_and_act/v1.json#/$defs/query_task",
          "description": "The query currently backing the view. Interactions REPLACE this with a transformed copy (rules/interactions.json); the executor is the same one endpoint that serves prebuilt cards."
        },
        "envelope": { "$ref": "#/$defs/envelope" },
        "view": { "$ref": "#/$defs/view" },
        "provenance": {
          "type": "object",
          "additionalProperties": false,
          "properties": {
            "data_as_of": { "type": "string", "format": "date-time" },
            "provisional_from": { "type": "string", "format": "date" }
          }
        },
        "pin": {
          "type": "object",
          "additionalProperties": false,
          "description": "Generated charts are pinnable like prebuilt ones: pinning writes a card-definition (ad-dashboards-prebuilt schema) carrying the CURRENT query + view — a chart the user pivoted into shape keeps that shape as a standing card.",
          "properties": {
            "pinnable": { "type": "boolean", "default": true },
            "card_id": { "type": "string", "description": "assigned when pinned" }
          }
        }
      }
    },

    "envelope": {
      "type": "object",
      "additionalProperties": false,
      "required": ["platform", "entity", "facts", "dims", "grains", "source"],
      "description": "The navigable space. DERIVED BY CODE (generator/derive.py) from the query + catalog: facts from canonical metric keys (primitives.yaml metric_sources), dims from DM/bronze dimension keys with drill edges from rules/drill-graph.json, grains from the gold day-grain rollup rule. The LLM never authors this.",
      "properties": {
        "platform": { "type": "string" },
        "entity": { "type": "string" },
        "facts": {
          "type": "array", "minItems": 1,
          "items": {
            "type": "object", "additionalProperties": false,
            "required": ["key", "label", "unit"],
            "properties": {
              "key": { "type": "string", "pattern": "^[a-z][a-z0-9_]*$", "description": "canonical metric_sources key" },
              "label": { "type": "string", "description": "platform-native display word, verbatim" },
              "unit": { "enum": ["inr", "num", "pct", "x"] },
              "invert": { "type": "boolean" },
              "additive": { "type": "boolean", "description": "false for ratios/uniques (roas, reach) — non-additive facts never stack, never marimekko-size, never blend across platforms" }
            }
          }
        },
        "dims": {
          "type": "array",
          "items": {
            "type": "object", "additionalProperties": false,
            "required": ["key", "label", "kind"],
            "properties": {
              "key": { "type": "string", "pattern": "^[a-z][a-z0-9_]*$" },
              "label": { "type": "string" },
              "kind": { "enum": ["categorical", "temporal", "entity", "stage", "cohort"], "description": "stage dims (funnel steps) enable sankey; cohort dims (first-order period) enable cohort_matrix" },
              "cardinality": { "enum": ["low", "high"], "description": "low <= ~6 known members (placement, device, os) -> vertical bars; high (campaigns, products, keywords) -> ranked horizontal bars" },
              "drill_to": { "type": "array", "items": { "type": "string" }, "description": "dims reachable by clicking a member of THIS dim (rules/drill-graph.json edges); drill = where-predicate on the clicked value + swap to the target dim" }
            }
          }
        },
        "grains": { "type": "array", "items": { "enum": ["date", "week", "month"] }, "description": "gold stores day; week/month are date_trunc at read" },
        "source": { "enum": ["gold", "bronze"] }
      }
    },

    "view": {
      "type": "object",
      "additionalProperties": false,
      "required": ["intent", "representation", "y"],
      "description": "Current presentation state. representation comes from rules/representation-rules.json (first match wins — same data shape ALWAYS gets the same chart; never varied for variety). x/series/cell reference envelope dim keys or a grain; y references envelope fact keys. Max 2 facts on any chart except table.",
      "properties": {
        "intent": { "enum": ["kpi", "trend", "comparison", "composition", "distribution", "flow", "cohort", "detail"], "description": "the analytical ask. When the prompt is ambiguous the generator defaults (comparison for a categorical dim, trend for time) and moves on — no clarifying question, ever" },
        "representation": { "enum": ["kpi", "line", "bars_h", "bars_v", "table", "heatmap", "cohort_matrix", "sankey", "marimekko"], "description": "NO pie, NO area: spatial-area comparisons are banned by the ruleset" },
        "x": { "type": "string", "description": "dim key or grain on the x axis (line: a grain; bars: the category dim; heatmap: column dim; marimekko: width dim; sankey: source stage; cohort_matrix: cohort dim)" },
        "y": { "type": "array", "minItems": 1, "maxItems": 2, "items": { "type": "string" }, "description": "fact key(s). Two facts only when units are compatible or a dual axis is explicit; tables are exempt from the cap" },
        "series": { "type": "string", "description": "split dim (line: one line per member; bars: grouped; heatmap: row dim; marimekko: height dim; sankey: target stage; cohort_matrix: the age grain)" },
        "sort": { "type": "object", "additionalProperties": false, "properties": { "by": { "type": "string" }, "direction": { "enum": ["asc", "desc"] } }, "required": ["by", "direction"] },
        "limit": { "type": "integer", "minimum": 1, "description": "rankings default 10 then Show more" },
        "compare": { "type": "boolean", "description": "vs previous period (dashed grey). Defaults ON for kpi and trend — numbers never render without comparative context" },
        "share": { "type": "boolean", "description": "render the additive fact as % of the visible total alongside absolute (composition intent); ONLY on additive facts" }
      }
    },

    "interaction": {
      "type": "object",
      "additionalProperties": false,
      "required": ["type"],
      "description": "A user gesture on the chart, recorded and applied as a query/view transformation per rules/interactions.json. The server validates the transformed query against the envelope before executing: an interaction that leaves the envelope is rejected.",
      "properties": {
        "type": { "enum": ["drill", "pivot_dim", "pivot_fact", "regrain", "rerange", "toggle_compare", "sort", "pin", "unpin"] },
        "on_dim": { "type": "string" },
        "value": { "description": "clicked member (drill): becomes a where eq predicate" },
        "to": { "type": "string", "description": "target dim/fact/grain key — must exist in the envelope" },
        "date_range": { "$ref": "https://meerkats.ai/schemas/query_and_act/v1.json#/$defs/time_range" }
      }
    }
  }
}
